{
  "uaicp_version": "0.2",
  "request_id": "req-1001",
  "trace_id": "trace-1001",
  "state": "execute",
  "timestamp": "2026-01-01T00:00:00.000Z",
  "identity": {
    "agent_id": "agent:finance/approval-bot",
    "owner_id": "org:uaicp-demo",
    "control_class": "human-directed"
  },
  "metadata": {
    "intent": "reverse_wire_transfer"
  }
}
